{"schemaVersion":1,"packageType":"cluster-evidence","packageId":"PKG-44444444-4444-4444-8444-444444444444","protocolVersion":"1.0.0","protocolFingerprint":"14762ec54166640ffc2894514e16159650275beeca3852fb8904624435ffd0df","toolVersion":"1.0.0","timeModelFingerprint":"873774e52b6c9a20e08e5079c898a014493a39305be5efa35a601248ff36a2c1","scopeType":"cluster","scopeId":"CLUSTER-7-DATA-MEDIA-SOCIETY","context":{"schoolYear":"2026-27","term":"first-half","classSizeBand":"20-29","deviceClass":"mixed","browserFamily":"chromium","networkMode":"offline"},"deliveryTimeEvidence":{"plannedUnits":10,"actualUnits":10,"completedPhaseIds":["activate-prior-knowledge","build-concept","guided-practice","independent-action-product","orientation-challenge","review-revise-transfer","shared-consolidation"],"requiredLearningPhasesCompleted":true,"fallbackActivated":false,"technicalStartupMinutes":3,"supportDemandBand":"low","externalDisruptionCode":"none"},"learningQualityEvidence":{"moduleResults":[{"pilotAssignmentId":"PILOT-IUM-7-CORE-08","moduleId":"IUM-7-CORE-08","criteria":[{"criterionId":"CRIT-IUM-7-CORE-08-ACTION","band":"strong"},{"criterionId":"CRIT-IUM-7-CORE-08-PRODUCT","band":"strong"}],"result":"pass"},{"pilotAssignmentId":"PILOT-IUM-7-CORE-09","moduleId":"IUM-7-CORE-09","criteria":[{"criterionId":"CRIT-IUM-7-CORE-09-ACTION","band":"strong"},{"criterionId":"CRIT-IUM-7-CORE-09-PRODUCT","band":"strong"}],"result":"pass"},{"pilotAssignmentId":"PILOT-IUM-7-CORE-10","moduleId":"IUM-7-CORE-10","criteria":[{"criterionId":"CRIT-IUM-7-CORE-10-ACTION","band":"strong"},{"criterionId":"CRIT-IUM-7-CORE-10-PRODUCT","band":"strong"}],"result":"pass"}],"integrationResults":[{"pilotAssignmentId":"PILOT-INT-7-DATA-MEDIA-SOCIETY","integrationContractId":"INT-7-DATA-MEDIA-SOCIETY","criteria":[{"criterionId":"CRIT-INT-7-DATA-MEDIA-SOCIETY-HANDOFF-ACTIONS","band":"strong"},{"criterionId":"CRIT-INT-7-DATA-MEDIA-SOCIETY-HANDOFF-EVIDENCE","band":"strong"}],"handoffProductPresent":true,"handoffReused":true,"result":"pass"}]},"learnerPulseEvidence":{"status":"reported","classResponseCount":12,"items":[{"itemId":"clarity","agree":8,"partly":2,"disagree":1,"noAnswer":1},{"itemId":"cognitiveEngagement","agree":8,"partly":2,"disagree":1,"noAnswer":1},{"itemId":"supportUsefulness","agree":8,"partly":2,"disagree":1,"noAnswer":1}]},"technicalPrivacyEvidence":{"technicalFunction":"pass","fallbackEquivalentLearningFunction":false,"problemCode":"none","severity":"none","privacyGate":"pass"},"result":"pass","developmentWarnings":[],"retentionClass":"until-decision"}
