{"schemaVersion":1,"packageType":"annual-evidence","packageId":"PKG-55555555-5555-4555-8555-555555555555","protocolVersion":"1.0.0","protocolFingerprint":"14762ec54166640ffc2894514e16159650275beeca3852fb8904624435ffd0df","toolVersion":"1.0.0","timeModelFingerprint":"873774e52b6c9a20e08e5079c898a014493a39305be5efa35a601248ff36a2c1","scopeType":"annual","scopeId":"ANNUAL-7-WORKING-40","context":{"schoolYear":"2026-27","term":"full-year","classSizeBand":"20-29","deviceClass":"mixed","browserFamily":"chromium","networkMode":"offline"},"deliveryTimeEvidence":{"plannedUnits":40,"actualUnits":40,"completedPhaseIds":["activate-prior-knowledge","build-concept","guided-practice","independent-action-product","orientation-challenge","review-revise-transfer","shared-consolidation"],"requiredLearningPhasesCompleted":true,"fallbackActivated":false,"technicalStartupMinutes":12,"supportDemandBand":"low","externalDisruptionCode":"none","clusterOrder":["CLUSTER-7-DATA-CODING","CLUSTER-7-PROGRAMMING","CLUSTER-7-NET-SECURITY","CLUSTER-7-DATA-MEDIA-SOCIETY"],"clusterActualUnits":[{"clusterId":"CLUSTER-7-DATA-CODING","actualUnits":8},{"clusterId":"CLUSTER-7-PROGRAMMING","actualUnits":11},{"clusterId":"CLUSTER-7-NET-SECURITY","actualUnits":11},{"clusterId":"CLUSTER-7-DATA-MEDIA-SOCIETY","actualUnits":10}]},"learningQualityEvidence":{"moduleResults":[{"pilotAssignmentId":"PILOT-IUM-7-CORE-01","moduleId":"IUM-7-CORE-01","criteria":[{"criterionId":"CRIT-IUM-7-CORE-01-ACTION","band":"strong"},{"criterionId":"CRIT-IUM-7-CORE-01-PRODUCT","band":"strong"}],"result":"pass"},{"pilotAssignmentId":"PILOT-IUM-7-CORE-02","moduleId":"IUM-7-CORE-02","criteria":[{"criterionId":"CRIT-IUM-7-CORE-02-ACTION","band":"strong"},{"criterionId":"CRIT-IUM-7-CORE-02-PRODUCT","band":"strong"}],"result":"pass"},{"pilotAssignmentId":"PILOT-IUM-7-CORE-03","moduleId":"IUM-7-CORE-03","criteria":[{"criterionId":"CRIT-IUM-7-CORE-03-ACTION","band":"strong"},{"criterionId":"CRIT-IUM-7-CORE-03-PRODUCT","band":"strong"}],"result":"pass"},{"pilotAssignmentId":"PILOT-IUM-7-CORE-04","moduleId":"IUM-7-CORE-04","criteria":[{"criterionId":"CRIT-IUM-7-CORE-04-ACTION","band":"strong"},{"criterionId":"CRIT-IUM-7-CORE-04-PRODUCT","band":"strong"}],"result":"pass"},{"pilotAssignmentId":"PILOT-IUM-7-CORE-05","moduleId":"IUM-7-CORE-05","criteria":[{"criterionId":"CRIT-IUM-7-CORE-05-ACTION","band":"strong"},{"criterionId":"CRIT-IUM-7-CORE-05-PRODUCT","band":"strong"}],"result":"pass"},{"pilotAssignmentId":"PILOT-IUM-7-CORE-06","moduleId":"IUM-7-CORE-06","criteria":[{"criterionId":"CRIT-IUM-7-CORE-06-ACTION","band":"strong"},{"criterionId":"CRIT-IUM-7-CORE-06-PRODUCT","band":"strong"}],"result":"pass"},{"pilotAssignmentId":"PILOT-IUM-7-CORE-07","moduleId":"IUM-7-CORE-07","criteria":[{"criterionId":"CRIT-IUM-7-CORE-07-ACTION","band":"strong"},{"criterionId":"CRIT-IUM-7-CORE-07-PRODUCT","band":"strong"}],"result":"pass"},{"pilotAssignmentId":"PILOT-IUM-7-CORE-08","moduleId":"IUM-7-CORE-08","criteria":[{"criterionId":"CRIT-IUM-7-CORE-08-ACTION","band":"strong"},{"criterionId":"CRIT-IUM-7-CORE-08-PRODUCT","band":"strong"}],"result":"pass"},{"pilotAssignmentId":"PILOT-IUM-7-CORE-09","moduleId":"IUM-7-CORE-09","criteria":[{"criterionId":"CRIT-IUM-7-CORE-09-ACTION","band":"strong"},{"criterionId":"CRIT-IUM-7-CORE-09-PRODUCT","band":"strong"}],"result":"pass"},{"pilotAssignmentId":"PILOT-IUM-7-CORE-10","moduleId":"IUM-7-CORE-10","criteria":[{"criterionId":"CRIT-IUM-7-CORE-10-ACTION","band":"strong"},{"criterionId":"CRIT-IUM-7-CORE-10-PRODUCT","band":"strong"}],"result":"pass"}],"integrationResults":[{"pilotAssignmentId":"PILOT-INT-7-DATA-CODING","integrationContractId":"INT-7-DATA-CODING","criteria":[{"criterionId":"CRIT-INT-7-DATA-CODING-HANDOFF-ACTIONS","band":"strong"},{"criterionId":"CRIT-INT-7-DATA-CODING-HANDOFF-EVIDENCE","band":"strong"}],"handoffProductPresent":true,"handoffReused":true,"result":"pass"},{"pilotAssignmentId":"PILOT-INT-7-PROGRAMMING","integrationContractId":"INT-7-PROGRAMMING","criteria":[{"criterionId":"CRIT-INT-7-PROGRAMMING-HANDOFF-ACTIONS","band":"strong"},{"criterionId":"CRIT-INT-7-PROGRAMMING-HANDOFF-EVIDENCE","band":"strong"}],"handoffProductPresent":true,"handoffReused":true,"result":"pass"},{"pilotAssignmentId":"PILOT-INT-7-NET-SECURITY","integrationContractId":"INT-7-NET-SECURITY","criteria":[{"criterionId":"CRIT-INT-7-NET-SECURITY-HANDOFF-ACTIONS","band":"strong"},{"criterionId":"CRIT-INT-7-NET-SECURITY-HANDOFF-EVIDENCE","band":"strong"}],"handoffProductPresent":true,"handoffReused":true,"result":"pass"},{"pilotAssignmentId":"PILOT-INT-7-DATA-MEDIA-SOCIETY","integrationContractId":"INT-7-DATA-MEDIA-SOCIETY","criteria":[{"criterionId":"CRIT-INT-7-DATA-MEDIA-SOCIETY-HANDOFF-ACTIONS","band":"strong"},{"criterionId":"CRIT-INT-7-DATA-MEDIA-SOCIETY-HANDOFF-EVIDENCE","band":"strong"}],"handoffProductPresent":true,"handoffReused":true,"result":"pass"}]},"learnerPulseEvidence":{"status":"reported","classResponseCount":12,"items":[{"itemId":"clarity","agree":8,"partly":2,"disagree":1,"noAnswer":1},{"itemId":"cognitiveEngagement","agree":8,"partly":2,"disagree":1,"noAnswer":1},{"itemId":"supportUsefulness","agree":8,"partly":2,"disagree":1,"noAnswer":1}]},"technicalPrivacyEvidence":{"technicalFunction":"pass","fallbackEquivalentLearningFunction":false,"problemCode":"none","severity":"none","privacyGate":"pass"},"result":"pass","developmentWarnings":[],"retentionClass":"until-decision"}
